{
  "schemaVersion": "1.0",
  "createdAt": "2026-08-30T10:17:01Z",
  "reviewedRepositoryRevision": "7adaeac18ca259726468a2fe1d1fd028b895e09c",
  "assessmentResultsSha256": "49a573f71ee6c5e8c3b3bc193414c6dd1fa31c902ba32ed7431086cc4168705b",
  "acceptedInputBindings": [
    {
      "path": "Lastenheft_GSDB-Spec-Kit-Intensivpruefung.md",
      "sha256": "9b1963a5cc1e4f074e8fc918455f0285a0e1138334451523bd957ff21e72026a"
    },
    {
      "path": "specs/intake-review-results/sandbox-development-lifecycle.json",
      "sha256": "0d08a1e90e25965c4b529d66be6996394b963abef4ddb3c3b75dd678f464004b"
    },
    {
      "path": "specs/intake-series/sandbox-development-lifecycle/manifest.json",
      "sha256": "faa906c5acb7678265de75e28d80a337459d754ab53066f7a4f065ef24d1b3b2"
    }
  ],
  "outputBindings": [
    {
      "path": "docs/security/secure-development/2026-08-30-gsdb-baseline-assessment/README.md",
      "sha256": "261d317ce7df90632b4844b17a1a7433c85b53ea6b182f02cdbc120c5f6b0144"
    },
    {
      "path": "docs/security/secure-development/2026-08-30-gsdb-baseline-assessment/assessment-results.json",
      "sha256": "49a573f71ee6c5e8c3b3bc193414c6dd1fa31c902ba32ed7431086cc4168705b"
    },
    {
      "path": "docs/security/secure-development/2026-08-30-gsdb-baseline-assessment/evidence-matrix.md",
      "sha256": "1598948f37c148f980fcf89a6cd1c7d87d561045c2ba48820327bcb7e4ede51c"
    },
    {
      "path": "docs/security/secure-development/2026-08-30-gsdb-baseline-assessment/prioritized-gap-list.md",
      "sha256": "b7e631e9df5e37686ab1ff2c0a07552c5d59c23af28621c917e36d2a42f55542"
    },
    {
      "path": "docs/security/secure-development/2026-08-30-gsdb-baseline-assessment/inventory-reconciliation.md",
      "sha256": "03ba90d52f5474a02490d37a9f7f66f91540fb9d5b23a72a4c8265f16ebb74ee"
    },
    {
      "path": "docs/security/secure-development/2026-08-30-gsdb-baseline-assessment/documentation-impact.json",
      "sha256": "594a7fbde2b12761faf5aa1a3c8c21233f21e5bb216fa7fa443f48cb5cf5f177"
    }
  ],
  "validationResultsPath": "docs/security/secure-development/2026-08-30-gsdb-baseline-assessment/validation-results.json",
  "gateResults": [
    {
      "gateId": "accepted-input-binding",
      "applicability": "Applicable",
      "executedCommand": "Q02, Q03 and both Q04 blocks from specs/002-gsdb-baseline-assessment/quickstart.md were executed unchanged.",
      "runnerOrPlatform": "macOS (Darwin), PowerShell 7.6.5",
      "startedAt": "2026-08-30T10:17:01Z",
      "finishedAt": "2026-08-30T10:17:01Z",
      "exitCode": 0,
      "result": "Pass",
      "expectedResult": "Verify the three accepted repository-relative input paths and SHA-256 values from spec.md before assessment authoring and again before delivery.",
      "observedResult": "Q02 confirmed run 20befce1-05ca-45ea-b145-1e23afaa1e31, feature 002-gsdb-baseline-assessment, stage Implement, Active state and the start baseline 0/68 tasks. Q03 matched all three accepted paths and hashes. Bash and PowerShell Q04 validators accepted the completed Analyze result.",
      "evidencePath": "docs/security/secure-development/2026-08-30-gsdb-baseline-assessment/assessment-results.json",
      "limitations": "This result covers T001-T062 local implementation. Staging, commit, remote review, merge, PostMerge, and final closeout T063-T068 are deliberately not claimed.",
      "inputSha256": "81d2ba907976d69539046d43bd0bc0bd4f5309ee341b51d7d8ede100e9e67954",
      "outputSha256": "49a573f71ee6c5e8c3b3bc193414c6dd1fa31c902ba32ed7431086cc4168705b",
      "rationale": "N/A",
      "reevaluationTrigger": "Re-run when an accepted input, source, output, validator, platform observation, or current task boundary changes."
    },
    {
      "gateId": "gsdb-source-integrity",
      "applicability": "Applicable",
      "executedCommand": "Q08 from specs/002-gsdb-baseline-assessment/quickstart.md was executed unchanged.",
      "runnerOrPlatform": "macOS (Darwin), PowerShell 7.6.5",
      "startedAt": "2026-08-30T10:17:01Z",
      "finishedAt": "2026-08-30T10:17:01Z",
      "exitCode": 0,
      "result": "Pass",
      "expectedResult": "Read the baseline manifest and canonical checklist headings; prove all 37 manifest-controlled paths, twelve checklist sources, and exactly 157 unique stable IDs while mapping every manifest, version, compendium, or generator drift to one open gap rather than silently repairing it.",
      "observedResult": "Q08 found exactly 37 source paths, 12 checklist documents with counts 12/13/15/10/13/11/12/13/17/17/12/12, 157 unique CL IDs and complete compendium parity. Version and missing-generator drift remain Open findings.",
      "evidencePath": "docs/security/secure-development/2026-08-30-gsdb-baseline-assessment/assessment-results.json",
      "limitations": "This result covers T001-T062 local implementation. Staging, commit, remote review, merge, PostMerge, and final closeout T063-T068 are deliberately not claimed.",
      "inputSha256": "81d2ba907976d69539046d43bd0bc0bd4f5309ee341b51d7d8ede100e9e67954",
      "outputSha256": "49a573f71ee6c5e8c3b3bc193414c6dd1fa31c902ba32ed7431086cc4168705b",
      "rationale": "N/A",
      "reevaluationTrigger": "Re-run when an accepted input, source, output, validator, platform observation, or current task boundary changes."
    },
    {
      "gateId": "assessment-schema-contract",
      "applicability": "Applicable",
      "executedCommand": "Q06, Q07, Q09 and Q10 from specs/002-gsdb-baseline-assessment/quickstart.md were executed unchanged, including negative fixtures.",
      "runnerOrPlatform": "macOS (Darwin), PowerShell 7.6.5",
      "startedAt": "2026-08-30T10:17:01Z",
      "finishedAt": "2026-08-30T10:17:01Z",
      "exitCode": 0,
      "result": "Pass",
      "expectedResult": "Validate assessment-results.json and validation-results.json against their reviewed JSON Schemas; prove exactly 157 rows, resolved object references, current output hashes, all mandatory fields, and controlled vocabulary values.",
      "observedResult": "Q06 rejected an empty object. Q07/Q09 rejected the missing CL-12-05 fixture; Q09 rejected the broken reciprocal-gap fixture; canonical Q07 and Q09 passed.",
      "evidencePath": "docs/security/secure-development/2026-08-30-gsdb-baseline-assessment/assessment-results.json",
      "limitations": "This result covers T001-T062 local implementation. Staging, commit, remote review, merge, PostMerge, and final closeout T063-T068 are deliberately not claimed.",
      "inputSha256": "81d2ba907976d69539046d43bd0bc0bd4f5309ee341b51d7d8ede100e9e67954",
      "outputSha256": "49a573f71ee6c5e8c3b3bc193414c6dd1fa31c902ba32ed7431086cc4168705b",
      "rationale": "N/A",
      "reevaluationTrigger": "Re-run when an accepted input, source, output, validator, platform observation, or current task boundary changes."
    },
    {
      "gateId": "coverage-status-and-gap-traceability",
      "applicability": "Applicable",
      "executedCommand": "Q09, Q10 and Q11 from specs/002-gsdb-baseline-assessment/quickstart.md were executed unchanged.",
      "runnerOrPlatform": "macOS (Darwin), PowerShell 7.6.5",
      "startedAt": "2026-08-30T10:17:01Z",
      "finishedAt": "2026-08-30T10:17:01Z",
      "exitCode": 0,
      "result": "Pass",
      "expectedResult": "Compare canonical and assessed CL-ID sets; require zero missing, duplicate, or extra IDs, valid FR-007 status combinations, current existing local evidence for positive assessments, reciprocal exact gap mappings, and a recorded sample of one row per checklist traceable within 1,800 seconds total.",
      "observedResult": "Q09 reported 157/157 with every error list empty. Q10 resolved all bindings and 12 samples in 60 seconds. Q11 proved 157 matrix rows, 157 gap sections and 29 inventory sections with no drift.",
      "evidencePath": "docs/security/secure-development/2026-08-30-gsdb-baseline-assessment/assessment-results.json",
      "limitations": "This result covers T001-T062 local implementation. Staging, commit, remote review, merge, PostMerge, and final closeout T063-T068 are deliberately not claimed.",
      "inputSha256": "81d2ba907976d69539046d43bd0bc0bd4f5309ee341b51d7d8ede100e9e67954",
      "outputSha256": "49a573f71ee6c5e8c3b3bc193414c6dd1fa31c902ba32ed7431086cc4168705b",
      "rationale": "N/A",
      "reevaluationTrigger": "Re-run when an accepted input, source, output, validator, platform observation, or current task boundary changes."
    },
    {
      "gateId": "inventory-reconciliation",
      "applicability": "Applicable",
      "executedCommand": "Q12, Q13, Q14, Q15 and Q16 were executed; Q17 remained Open because its runtime precondition was unavailable.",
      "runnerOrPlatform": "macOS (Darwin), PowerShell 7.6.5",
      "startedAt": "2026-08-30T10:17:01Z",
      "finishedAt": "2026-08-30T10:17:01Z",
      "exitCode": 0,
      "result": "Pass",
      "expectedResult": "Reconcile six MSL families, two separate scripting/support foundations, four required agents, two additional agent surfaces, and twelve installed presets across declarations, runtime evidence, tests, dispatchers, registries, and documentation; map every mismatch to one gap.",
      "observedResult": "Q12-Q16 passed the static 6/2/4/2/8/4 profile and dispatcher/preset checks. Q17 was not executed because the intended Podman endpoint and ade service were unavailable; runtime observations remain Open with owner and retry trigger.",
      "evidencePath": "docs/security/secure-development/2026-08-30-gsdb-baseline-assessment/assessment-results.json",
      "limitations": "macOS static evidence passed. Linux, Windows/WSL2, practical Podman runtime, provider and sign-in observations remain Open; retry when the relevant platform or approved environment is available.",
      "inputSha256": "81d2ba907976d69539046d43bd0bc0bd4f5309ee341b51d7d8ede100e9e67954",
      "outputSha256": "49a573f71ee6c5e8c3b3bc193414c6dd1fa31c902ba32ed7431086cc4168705b",